{
"format": "py8dis",
"version": 1,
"cpu": "6502",
"assembler": "beebasm",
"loads": [
  {"filename": "orig/helloworld.orig", "start": 8192, "end": 8220}
],
"moves": [],
"constants": [],
"memory_regions": [
  {"start": 0, "end": 256, "name": "Zero page"},
  {"start": 256, "end": 512, "name": "Stack"},
  {"start": 65530, "end": 65536, "name": "6502 vectors"}
],
"subroutines": [],
"labels": [
  {"runtime_addr": 8192, "names": [{"name": "pydis_start", "autogenerated": true, "definition": "inline"}]},
  {"runtime_addr": 8194, "names": [{"name": "loop_c2002", "autogenerated": true, "definition": "inline"}], "references": [{"binary_addr": 8203, "runtime_addr": 8203}]},
  {"runtime_addr": 8206, "names": [{"name": "l200e", "autogenerated": true, "definition": "inline"}], "references": [{"binary_addr": 8194, "runtime_addr": 8194}]},
  {"runtime_addr": 8220, "names": [{"name": "pydis_end", "autogenerated": true, "definition": "inline"}]},
  {"runtime_addr": 65507, "names": [{"name": "lffe3", "autogenerated": true, "definition": "memory_locations"}], "references": [{"binary_addr": 8197, "runtime_addr": 8197}]}
],
"items": [
  {"binary_addr": 8192, "runtime_addr": 8192, "length": 2, "bytes": [162, 0], "labels": ["pydis_start"], "type": "instruction", "text": ["ldx #0"], "mnemonic": "ldx", "mode": "immediate", "operand": {"value": 0, "expr": {"text": "0", "tree": {"num": 0, "format": "decimal"}}}, "cycles": "2", "cpu_state": {"a": null, "x": 0, "y": null, "n": false, "v": null, "d": null, "i": null, "z": true, "c": null}},
  {"binary_addr": 8194, "runtime_addr": 8194, "length": 3, "bytes": [189, 14, 32], "labels": ["loop_c2002"], "comments": [{"text": "&2002 referenced 1 time by &200b", "align": "before_label", "autogenerated": true}], "type": "instruction", "text": ["lda l200e,x"], "mnemonic": "lda", "mode": "absolute_x", "operand": {"value": 8206, "expr": {"text": "l200e", "tree": {"label": 8206, "name": "l200e"}}}, "cycles": "4/5", "cpu_state": {"a": null, "x": null, "y": null, "n": null, "v": null, "d": null, "i": null, "z": null, "c": null}},
  {"binary_addr": 8197, "runtime_addr": 8197, "length": 3, "bytes": [32, 227, 255], "type": "instruction", "text": ["jsr lffe3"], "mnemonic": "jsr", "mode": "absolute", "operand": {"value": 65507, "expr": {"text": "lffe3", "tree": {"label": 65507, "name": "lffe3"}}}, "target": 65507, "cycles": "6", "cpu_state": {"a": null, "x": null, "y": null, "n": null, "v": null, "d": null, "i": null, "z": null, "c": null}},
  {"binary_addr": 8200, "runtime_addr": 8200, "length": 1, "bytes": [232], "type": "instruction", "text": ["inx"], "mnemonic": "inx", "mode": "implied", "cycles": "2", "cpu_state": {"a": null, "x": null, "y": null, "n": null, "v": null, "d": null, "i": null, "z": null, "c": null}},
  {"binary_addr": 8201, "runtime_addr": 8201, "length": 2, "bytes": [224, 14], "type": "instruction", "text": ["cpx #&0e"], "mnemonic": "cpx", "mode": "immediate", "operand": {"value": 14, "expr": {"text": "&0e", "tree": {"num": 14, "format": "hex2"}}}, "cycles": "2", "cpu_state": {"a": null, "x": null, "y": null, "n": null, "v": null, "d": null, "i": null, "z": null, "c": null}},
  {"binary_addr": 8203, "runtime_addr": 8203, "length": 2, "bytes": [208, 245], "type": "instruction", "text": ["bne loop_c2002"], "mnemonic": "bne", "mode": "relative", "operand": {"value": 8194, "expr": {"text": "loop_c2002", "tree": {"label": 8194, "name": "loop_c2002"}}}, "target": 8194, "cycles": "2/3", "cpu_state": {"a": null, "x": null, "y": null, "n": null, "v": null, "d": null, "i": null, "z": true, "c": true}},
  {"binary_addr": 8205, "runtime_addr": 8205, "length": 1, "bytes": [96], "type": "instruction", "text": ["rts"], "mnemonic": "rts", "mode": "implied", "cycles": "6", "cpu_state": {"a": null, "x": null, "y": null, "n": null, "v": null, "d": null, "i": null, "z": null, "c": null}},
  {"binary_addr": 8206, "runtime_addr": 8206, "length": 13, "bytes": [72, 101, 108, 108, 111, 44, 32, 119, 111, 114, 108, 100, 33], "labels": ["l200e"], "comments": [{"text": "&200e referenced 1 time by &2002", "align": "before_label", "autogenerated": true}], "type": "string", "text": ["equs \"Hello, world!\""]},
  {"binary_addr": 8219, "runtime_addr": 8219, "length": 1, "bytes": [13], "type": "bytes", "text": ["equb &0d"], "values": [13]}
]
}
